<?xml version="1.0" encoding="UTF-8"?>
<college xmlns:xsi="http://www.w3.org/2001/XMLSchema-instance"
         xsi:noNamespaceSchemaLocation="college.xsd">

    <student>
        <name>Akriti Niroula</name>
        <address>Belbari</address>
        <phone>980671234</phone>
    </student>
    
    <student>
        <name>Parina Bhujel</name>
        <address>Itahri</address>
        <phone>9845675678</phone>
    </student>
    
    <subject>BCA</subject>
    <subject>BIT</subject>
    <subject>MIT</subject>
    
</college>